<?xml version="1.0" encoding="UTF-8"?>
<xs:schema xmlns:xs="http://www.w3.org/2001/XMLSchema"
           targetNamespace="sje2d" xmlns="sje2d"
           attributeFormDefault="unqualified" elementFormDefault="qualified">
  <xs:element name="font" type="fontType"/>
  <xs:complexType name="baseType" mixed="true">
    <xs:sequence>
      <xs:element type="xs:string" name="family"/>
      <xs:element type="xs:string" name="size"/>
      <xs:element type="xs:string" name="italic"/>
      <xs:element type="xs:string" name="bold"/>
    </xs:sequence>
    <xs:attribute type="xs:string" name="type"/>
  </xs:complexType>
  <xs:complexType name="ruleType" mixed="true">
    <xs:sequence>
      <xs:element type="xs:string" name="family" minOccurs="0"/>
      <xs:element type="xs:string" name="size" minOccurs="0"/>
      <xs:element type="xs:string" name="italic" minOccurs="0"/>
      <xs:element type="xs:string" name="bold" minOccurs="0"/>
    </xs:sequence>
    <xs:attribute type="xs:string" name="min" use="required"/>
    <xs:attribute type="xs:string" name="max" use="required"/>
    <xs:attribute type="xs:string" name="type" use="required"/>
  </xs:complexType>
  <xs:complexType name="rulesType">
    <xs:sequence>
      <xs:element type="ruleType" name="rule" maxOccurs="unbounded" minOccurs="0"/>
    </xs:sequence>
  </xs:complexType>
  <xs:complexType name="fontType">
    <xs:sequence>
      <xs:element type="xs:string" name="name"/>
      <xs:element type="xs:string" name="width"/>
      <xs:element type="baseType" name="base"/>
      <xs:element type="rulesType" name="rules"/>
    </xs:sequence>
  </xs:complexType>
</xs:schema>